[
  {
    "id": 1,
    "title": "Initial Meeting",
    "type": "Meeting",
    "date": "2023-11-15",
    "status": "Completed",
    "notes": "Discussed project requirements and timeline. Client is interested in our enterprise solution but has concerns about implementation timeline.",
    "relatedTo": "Acme Corporation",
    "assignedTo": "John Smith",
    "duration": "60 min",
    "location": "Client Office",
    "participants": ["Jane Doe", "Robert Johnson", "Michael Williams"],
    "followUpDate": "2023-11-22",
    "followUpType": "Call",
    "priority": "High",
    "outcome": "Positive",
    "nextSteps": "Prepare detailed implementation timeline and resource allocation plan",
    "attachments": ["meeting_notes.pdf", "requirements.docx"],
    "tags": ["initial", "requirements", "enterprise"],
    "createdBy": "Sarah Johnson",
    "createdAt": "2023-11-14",
    "updatedAt": "2023-11-15"
  },
  {
    "id": 2,
    "title": "Follow-up Call",
    "type": "Call",
    "date": "2023-11-20",
    "status": "Completed",
    "notes": "Answered questions about pricing structure and implementation timeline. Client requested additional information about support options.",
    "relatedTo": "Acme Corporation",
    "assignedTo": "Sarah Johnson",
    "duration": "30 min",
    "location": "Virtual",
    "participants": ["John Smith", "Robert Johnson"],
    "followUpDate": "2023-11-27",
    "followUpType": "Email",
    "priority": "Medium",
    "outcome": "Positive",
    "nextSteps": "Send detailed pricing breakdown and support package options",
    "attachments": ["call_notes.pdf"],
    "tags": ["follow-up", "pricing", "support"],
    "createdBy": "Sarah Johnson",
    "createdAt": "2023-11-19",
    "updatedAt": "2023-11-20"
  },
  {
    "id": 3,
    "title": "Proposal Presentation",
    "type": "Meeting",
    "date": "2023-12-01",
    "status": "Scheduled",
    "notes": "Will present the full proposal to the executive team. Need to focus on ROI and implementation timeline.",
    "relatedTo": "Globex Inc",
    "assignedTo": "Michael Brown",
    "duration": "90 min",
    "location": "Client Headquarters",
    "participants": ["Sarah Johnson", "David Miller", "Jennifer Lee", "Robert Wilson"],
    "followUpDate": "2023-12-08",
    "followUpType": "Meeting",
    "priority": "High",
    "outcome": null,
    "nextSteps": "Prepare executive summary and ROI analysis",
    "attachments": ["proposal_draft.pdf", "presentation.pptx"],
    "tags": ["proposal", "executive", "presentation"],
    "createdBy": "Michael Brown",
    "createdAt": "2023-11-22",
    "updatedAt": "2023-11-22"
  },
  {
    "id": 4,
    "title": "Contract Review",
    "type": "Task",
    "date": "2023-12-10",
    "status": "In Progress",
    "notes": "Legal team reviewing contract terms. Need to clarify service level agreements and liability clauses.",
    "relatedTo": "Umbrella Corporation",
    "assignedTo": "Emily Davis",
    "duration": "120 min",
    "location": "Internal",
    "participants": ["Legal Team", "Sales Team"],
    "followUpDate": "2023-12-12",
    "followUpType": "Meeting",
    "priority": "High",
    "outcome": null,
    "nextSteps": "Schedule call with client legal team to discuss revisions",
    "attachments": ["contract_draft.docx", "legal_notes.pdf"],
    "tags": ["legal", "contract", "review"],
    "createdBy": "Emily Davis",
    "createdAt": "2023-12-05",
    "updatedAt": "2023-12-08"
  },
  {
    "id": 5,
    "title": "Demo Session",
    "type": "Meeting",
    "date": "2023-12-15",
    "status": "Scheduled",
    "notes": "Product demo for the IT department. Focus on technical capabilities and integration options.",
    "relatedTo": "Stark Industries",
    "assignedTo": "Robert Wilson",
    "duration": "60 min",
    "location": "Virtual",
    "participants": ["IT Team", "Project Managers"],
    "followUpDate": "2023-12-18",
    "followUpType": "Call",
    "priority": "Medium",
    "outcome": null,
    "nextSteps": "Prepare technical documentation and API specifications",
    "attachments": ["demo_script.docx", "technical_specs.pdf"],
    "tags": ["demo", "technical", "it-department"],
    "createdBy": "Robert Wilson",
    "createdAt": "2023-12-01",
    "updatedAt": "2023-12-01"
  },
  {
    "id": 6,
    "title": "Email Campaign",
    "type": "Task",
    "date": "2023-11-25",
    "status": "Completed",
    "notes": "Sent promotional materials to key stakeholders. Included case studies and testimonials relevant to their industry.",
    "relatedTo": "Wayne Enterprises",
    "assignedTo": "Jennifer Lee",
    "duration": "45 min",
    "location": "Internal",
    "participants": ["Marketing Team"],
    "followUpDate": "2023-12-02",
    "followUpType": "Email",
    "priority": "Medium",
    "outcome": "Completed",
    "nextSteps": "Track open rates and responses, follow up with interested parties",
    "attachments": ["campaign_analytics.pdf", "email_template.html"],
    "tags": ["marketing", "email", "campaign"],
    "createdBy": "Jennifer Lee",
    "createdAt": "2023-11-20",
    "updatedAt": "2023-11-25"
  },
  {
    "id": 7,
    "title": "Requirements Gathering",
    "type": "Meeting",
    "date": "2024-01-05",
    "status": "Scheduled",
    "notes": "Technical requirements discussion with client team. Need to understand integration points and data migration needs.",
    "relatedTo": "Cyberdyne Systems",
    "assignedTo": "David Miller",
    "duration": "120 min",
    "location": "Client Office",
    "participants": ["Technical Team", "Project Managers", "Client IT Staff"],
    "followUpDate": "2024-01-12",
    "followUpType": "Meeting",
    "priority": "High",
    "outcome": null,
    "nextSteps": "Prepare technical requirements document and project plan",
    "attachments": ["requirements_template.docx"],
    "tags": ["requirements", "technical", "planning"],
    "createdBy": "David Miller",
    "createdAt": "2023-12-15",
    "updatedAt": "2023-12-15"
  },
  {
    "id": 8,
    "title": "Budget Approval",
    "type": "Task",
    "date": "2023-12-20",
    "status": "Pending",
    "notes": "Waiting for client to approve project budget. Follow up if no response by December 22.",
    "relatedTo": "Oscorp",
    "assignedTo": "Lisa Chen",
    "duration": "30 min",
    "location": "Internal",
    "participants": ["Finance Team", "Sales Team"],
    "followUpDate": "2023-12-22",
    "followUpType": "Call",
    "priority": "High",
    "outcome": null,
    "nextSteps": "Send reminder email if no response by follow-up date",
    "attachments": ["budget_proposal.pdf", "cost_breakdown.xlsx"],
    "tags": ["budget", "approval", "finance"],
    "createdBy": "Lisa Chen",
    "createdAt": "2023-12-15",
    "updatedAt": "2023-12-15"
  },
  {
    "id": 9,
    "title": "Quarterly Review",
    "type": "Meeting",
    "date": "2024-01-15",
    "status": "Scheduled",
    "notes": "Review of Q4 performance and Q1 goals. Prepare metrics on service delivery and support response times.",
    "relatedTo": "Initech",
    "assignedTo": "John Smith",
    "duration": "90 min",
    "location": "Client Office",
    "participants": ["Account Team", "Client Stakeholders"],
    "followUpDate": "2024-01-22",
    "followUpType": "Email",
    "priority": "Medium",
    "outcome": null,
    "nextSteps": "Prepare quarterly report and performance metrics",
    "attachments": ["q4_metrics.xlsx", "q1_goals.pptx"],
    "tags": ["quarterly", "review", "metrics"],
    "createdBy": "John Smith",
    "createdAt": "2023-12-20",
    "updatedAt": "2023-12-20"
  },
  {
    "id": 10,
    "title": "Support Call",
    "type": "Call",
    "date": "2023-11-30",
    "status": "Completed",
    "notes": "Resolved technical issues with the client's installation. Updated software to latest version and provided additional training.",
    "relatedTo": "Massive Dynamic",
    "assignedTo": "Sarah Johnson",
    "duration": "45 min",
    "location": "Virtual",
    "participants": ["Technical Support", "Client IT Staff"],
    "followUpDate": "2023-12-07",
    "followUpType": "Email",
    "priority": "High",
    "outcome": "Resolved",
    "nextSteps": "Send follow-up email with documentation and best practices",
    "attachments": ["support_ticket.pdf", "resolution_steps.docx"],
    "tags": ["support", "technical", "resolution"],
    "createdBy": "Sarah Johnson",
    "createdAt": "2023-11-30",
    "updatedAt": "2023-11-30"
  }
]
